{
  "$schema": "https://json-schema.org/draft/2020-12/schema",
  "$id": "https://creator-os.local/schemas/provider_spend_authorization.v2.schema.json",
  "title": "Campaign Factory Provider Spend Authorization v2",
  "type": "object",
  "additionalProperties": false,
  "required": ["schema", "authorizationId", "reservationId", "issuer", "status", "issuedAt", "expiresAt", "scope", "providerQuote", "signature"],
  "properties": {
    "schema": {"const": "campaign_factory.provider_spend_authorization.v2"},
    "authorizationId": {"type": "string", "minLength": 1},
    "reservationId": {"type": "string", "minLength": 1},
    "issuer": {"const": "campaign_factory"},
    "status": {"const": "authorized"},
    "issuedAt": {"type": "string", "format": "date-time"},
    "expiresAt": {"type": "string", "format": "date-time"},
    "scope": {
      "type": "object",
      "additionalProperties": false,
      "required": ["provider", "providerModel", "operation", "campaign", "cohortId", "providerCallCount", "promptSha256", "mediaSha256", "parameters", "requestFingerprint"],
      "properties": {
        "provider": {"enum": ["wavespeed"]},
        "providerModel": {"type": "string", "minLength": 1},
        "operation": {"type": "string", "minLength": 1},
        "campaign": {"type": "string", "minLength": 1},
        "cohortId": {"type": "string", "minLength": 1},
        "providerCallCount": {"const": 1},
        "promptSha256": {"type": "string", "pattern": "^[0-9a-f]{64}$"},
        "mediaSha256": {
          "type": "object",
          "minProperties": 1,
          "additionalProperties": {"type": "string", "pattern": "^[0-9a-f]{64}$"}
        },
        "parameters": {"type": "object"},
        "requestFingerprint": {"type": "string", "pattern": "^[0-9a-f]{64}$"}
      }
    },
    "providerQuote": {
      "type": "object",
      "additionalProperties": false,
      "required": ["provider", "model", "amount", "unit", "pricingVersion", "pricingFingerprint", "catalogBasePrice", "catalogModelId", "liveQuotedAmount", "livePriceSource"],
      "properties": {
        "provider": {"const": "wavespeed"},
        "model": {"type": "string", "minLength": 1},
        "amount": {"type": "number", "exclusiveMinimum": 0},
        "unit": {"const": "USD"},
        "pricingVersion": {"type": "string", "minLength": 1},
        "pricingFingerprint": {"type": "string", "pattern": "^[0-9a-f]{64}$"},
        "catalogBasePrice": {"type": "number", "exclusiveMinimum": 0},
        "catalogModelId": {"type": "string", "minLength": 1},
        "liveQuotedAmount": {"type": "number", "exclusiveMinimum": 0},
        "livePriceSource": {
        "enum": [
          "wavespeed_model_pricing_api",
          "pinned_audio_duration_rate",
          "pinned_reference_duration_rate"
        ]
        }
      }
    },
    "signature": {"type": "string", "pattern": "^[0-9a-f]{64}$"}
  }
}
